{
  "proofVersion": "0.1",
  "hashAlgorithm": "SHA-256",
  "leaf": {
    "hash": "afc6dabbab005e2526b93164376c8bdd54184dff2ab49ef09cd7152cd48912cb",
    "index": 1,
    "eventId": "018f2a30-1111-7222-8333-444455556602"
  },
  "path": [
    {
      "side": "left",
      "hash": "a6eda3d87ca03442e74a2d866ae5cb15c0dbf1b98e9fcbe727ec265f4c71db74"
    },
    {
      "side": "right",
      "hash": "1d06e9f239f757bdad0398feaa49e091fcb5c8de89802025c821eaa93379ad4a"
    }
  ],
  "root": {
    "hash": "a43e376630ac6ebb7f3385a79e02a5b01826d925a5199d249511584c22f6822f",
    "leafCount": 3,
    "anchor": {
      "type": "publication",
      "reference": "https://audit-archive.example/trees/platform-control-service/2026-04-03",
      "recordedAt": "2026-04-03T10:00:05Z"
    },
    "signature": {
      "algorithm": "Ed25519",
      "value": "nv9/DCnCY3Ymugdc8CKDLcJdaEyJyy+ecH/GQX05KzFQcIksLT3EEWlGZtfnqJdL/ckwUMH+cDv6jpCgV+tWCQ==",
      "keyId": "example-fixture-key-2026"
    }
  }
}
